{
  "status": "applied",
  "configPath": "/tmp/openclaw-apply-secret-test.json",
  "backupPath": "/tmp/openclaw-apply-secret-test.json.bak-20260405-063721-feishu-agent-ops",
  "summary": {
    "jsonOpsApplied": 9,
    "filesystemOpsApplied": 6,
    "configExistedBefore": true,
    "resolvedSecretsApplied": 3
  },
  "createdPaths": [
    "/root/.openclaw/workspace-manager",
    "/root/.openclaw/agents/manager/agent",
    "/root/.openclaw/workspace-research",
    "/root/.openclaw/agents/research/agent",
    "/root/.openclaw/workspace-writer",
    "/root/.openclaw/agents/writer/agent"
  ],
  "warnings": []
}
